{
  "$schema": "../schema/vaccine.schema.json",
  "id": "menveo",
  "name": "Menveo",
  "aliases": [
    "MenACWY"
  ],
  "manufacturer": "GSK",
  "diseases": [
    "meningococcal-a",
    "meningococcal-c",
    "meningococcal-w",
    "meningococcal-y"
  ],
  "type": "subunit",
  "variant": "any",
  "markets": [
    "DE"
  ]
}
