{
  "$schema": "../schema/vaccine.schema.json",
  "id": "priorix-tetra",
  "name": "Priorix-Tetra",
  "aliases": [
    "MMRV"
  ],
  "manufacturer": "GSK",
  "diseases": [
    "measles",
    "mumps",
    "rubella",
    "varicella"
  ],
  "type": "live",
  "variant": "pediatric",
  "markets": [
    "DE"
  ]
}
